{
  "schema_version": "1.0",
  "bank_id": "71000000-0000-4000-8000-000000000001",
  "title": "辅助抽取神经病学题库",
  "questions": [
    {
      "question_id": "72000000-0000-4000-8000-000000000001",
      "question_revision": 1,
      "question_type": "single_choice",
      "stem": "正常成人视力通常记录为？",
      "options": [
        {
          "label": "A",
          "text": "1.0",
          "source_option_id": "73000000-0000-4000-8000-000000000001"
        },
        {
          "label": "B",
          "text": "0.1",
          "source_option_id": "73000000-0000-4000-8000-000000000002"
        }
      ],
      "source_reference": {
        "source_id": "61000000-0000-4000-8000-000000000001",
        "locator": "page:1"
      },
      "status": "candidate",
      "chapter": "眼科学",
      "metadata": {
        "qbc_extraction_notes": "原扫描件答案标记不清晰。"
      }
    },
    {
      "question_id": "72000000-0000-4000-8000-000000000002",
      "question_revision": 1,
      "question_type": "multiple_choice",
      "stem": "下列哪些属于脑神经？",
      "options": [
        {
          "label": "A",
          "text": "视神经",
          "source_option_id": "73000000-0000-4000-8000-000000000003"
        },
        {
          "label": "B",
          "text": "桡神经",
          "source_option_id": "73000000-0000-4000-8000-000000000004"
        },
        {
          "label": "C",
          "text": "面神经",
          "source_option_id": "73000000-0000-4000-8000-000000000005"
        }
      ],
      "source_reference": {
        "source_id": "61000000-0000-4000-8000-000000000001",
        "locator": "page:2"
      },
      "status": "candidate",
      "chapter": "脑神经",
      "answer": [
        "A",
        "C"
      ],
      "explanation": "视神经和面神经均属于脑神经。"
    },
    {
      "question_id": "72000000-0000-4000-8000-000000000003",
      "question_revision": 1,
      "question_type": "true_false",
      "stem": "周围神经属于中枢神经系统。",
      "options": [],
      "source_reference": {
        "source_id": "61000000-0000-4000-8000-000000000002",
        "locator": "page:3"
      },
      "status": "candidate",
      "answer": false
    }
  ],
  "sources": [
    {
      "source_id": "61000000-0000-4000-8000-000000000001",
      "source_file": "神经病学题库.pdf",
      "source_type": "pdf"
    },
    {
      "source_id": "61000000-0000-4000-8000-000000000002",
      "source_file": "扫描判断题.png",
      "source_type": "image"
    }
  ]
}
