{
  "schema_version": "1.0",
  "bank_id": "51000000-0000-4000-8000-000000000001",
  "title": "神经病学标准题库",
  "questions": [
    {
      "question_id": "53000000-0000-4000-8000-000000000001",
      "question_revision": 1,
      "question_type": "single_choice",
      "stem": "哪一项属于中枢神经系统？",
      "options": [
        {
          "label": "A",
          "text": "脑",
          "source_option_id": "54000000-0000-4000-8000-000000000001"
        },
        {
          "label": "B",
          "text": "周围神经",
          "source_option_id": "54000000-0000-4000-8000-000000000002"
        }
      ],
      "source_reference": {
        "source_id": "52000000-0000-4000-8000-000000000001",
        "locator": "page:1"
      },
      "status": "candidate"
    },
    {
      "question_id": "53000000-0000-4000-8000-000000000002",
      "question_revision": 1,
      "question_type": "multiple_choice",
      "stem": "下列哪些属于脑神经？",
      "options": [
        {
          "label": "A",
          "text": "视神经",
          "source_option_id": "54000000-0000-4000-8000-000000000003"
        },
        {
          "label": "B",
          "text": "桡神经",
          "source_option_id": "54000000-0000-4000-8000-000000000004"
        },
        {
          "label": "C",
          "text": "面神经",
          "source_option_id": "54000000-0000-4000-8000-000000000005"
        }
      ],
      "source_reference": {
        "source_id": "52000000-0000-4000-8000-000000000001",
        "locator": "page:2"
      },
      "status": "candidate",
      "chapter": "脑神经",
      "answer": [
        "A",
        "C"
      ],
      "explanation": "视神经和面神经均属于脑神经。"
    },
    {
      "question_id": "53000000-0000-4000-8000-000000000003",
      "question_revision": 1,
      "question_type": "true_false",
      "stem": "脑属于中枢神经系统。",
      "options": [],
      "source_reference": {
        "source_id": "52000000-0000-4000-8000-000000000002",
        "locator": "paragraph:3"
      },
      "status": "candidate",
      "answer": true
    }
  ],
  "sources": [
    {
      "source_id": "52000000-0000-4000-8000-000000000001",
      "source_file": "资料/神经病学题库.pdf",
      "source_type": "pdf"
    },
    {
      "source_id": "52000000-0000-4000-8000-000000000002",
      "source_file": "判断题.md",
      "source_type": "markdown"
    }
  ]
}
